{
  "$schema": "https://json-schema.org/draft/2020-12/schema",
  "type": "object",
  "additionalProperties": false,
  "required": ["$schema", "specVersion", "id", "title", "projectFolder", "entrypoint", "kind", "summary", "environments", "runtimes", "constraints"],
  "properties": {
    "$schema": {"type": "string"}, "specVersion": {"type": "string"}, "id": {"type": "string"}, "title": {"type": "string"},
    "projectFolder": {"type": "string"}, "entrypoint": {"type": "string"}, "kind": {"type": "string"}, "summary": {"type": "string"},
    "environments": {"type": "array"}, "runtimes": {"type": "array"}, "constraints": {"type": "array"}
  }
}
