{
  "$schema": "./spec.schema.json",
  "specVersion": "2.0.0",
  "id": "house-simulator",
  "title": "RoboCasa House Simulator",
  "projectFolder": "/Users/U124317/robot/simulator",
  "entrypoint": "run_env.sh",
  "kind": "Robot simulation environment",
  "summary": "A RoboCasa-backed, single-storey apartment-style house with a closed floor plan, connected rooms, and an articulated SO-101 arm mounted on a kitchen table, launched through one generic script in headless or interactive mode.",
  "environments": [
    {
      "id": "robocasa",
      "default": true,
      "viewerModes": ["headless", "interactive"],
      "scene": "A closed single-storey apartment with an outer wall perimeter, interior partition walls, traversable doorway gaps, a kitchen, and a kitchen table supporting the SO-101 arm.",
      "launcher": "./run_env.sh --env robocasa [--headless|--no-headless]"
    }
  ],
  "runtimes": [
    {
      "id": "robocasa",
      "command": "./run_env.sh --env robocasa",
      "defaults": {"headless": false},
      "arguments": {"env": ["robocasa"], "headless": [true, false]},
      "description": "The generic launcher validates its arguments, activates simulator/.venv, and starts the RoboCasa-backed house with a viewer by default or without one when --headless is supplied."
    }
  ],
  "constraints": [
    {"id": "package-manager", "description": "The project is managed with uv and uses the virtual environment at simulator/.venv."},
    {"id": "runtime", "description": "The installed and imported simulation framework is RoboCasa, using its MuJoCo and robosuite runtime dependencies."},
    {"id": "floor-plan", "description": "The world is a closed, single-storey apartment-style floor plan with a collidable floor, complete outer perimeter, interior partition walls, and doorway gaps wide enough to traverse."},
    {"id": "robot", "description": "The simulated robot is an articulated SO-101 arm described in URDF and mounted securely on a table in the kitchen."},
    {"id": "launcher", "description": "A single executable run_env.sh requires --env <runtime>, supports --headless and --no-headless, defaults to an interactive viewer, launches robocasa, and rejects unsupported or conflicting arguments."},
    {"id": "verification", "description": "Automated checks validate the documents, compile the scene, verify the floor plan and robot structure, and exercise the launcher headlessly without downloading the optional multi-gigabyte RoboCasa kitchen asset bundle."}
  ]
}
